{
  "template_id": "form_B",
  "name": "Standard Form A - 20 Questions",
  "version": "1.0.0",
  "canonical_size": {
    "width": 2100,
    "height": 2970
  },
  "registration_marks": [
    {
      "id": "top_left",
      "position": { "x": 500, "y": 500 },
      "type": "circle",
      "size": 20
    },
    {
      "id": "top_right",
      "position": { "x": 2000, "y": 100 },
      "type": "circle",
      "size": 20
    },
    {
      "id": "bottom_left",
      "position": { "x": 100, "y": 2870 },
      "type": "circle",
      "size": 20
    },
    {
      "id": "bottom_right",
      "position": { "x": 2000, "y": 2870 },
      "type": "circle",
      "size": 20
    }
  ],
  "bubble_config": {
    "radius": 12,
    "fill_threshold": 0.30,
    "ambiguous_threshold": 0.65
  },
  "questions": [
    {
      "question_id": 1,
      "options": {
        "A": { "x": 300, "y": 400 },
        "B": { "x": 380, "y": 400 },
        "C": { "x": 460, "y": 400 },
        "D": { "x": 540, "y": 400 }
      }
    },
    {
      "question_id": 2,
      "options": {
        "A": { "x": 300, "y": 480 },
        "B": { "x": 380, "y": 480 },
        "C": { "x": 460, "y": 480 },
        "D": { "x": 540, "y": 480 }
      }
    },
    {
      "question_id": 3,
      "options": {
        "A": { "x": 300, "y": 560 },
        "B": { "x": 380, "y": 560 },
        "C": { "x": 460, "y": 560 },
        "D": { "x": 540, "y": 560 }
      }
    },
    {
      "question_id": 4,
      "options": {
        "A": { "x": 300, "y": 640 },
        "B": { "x": 380, "y": 640 },
        "C": { "x": 460, "y": 640 },
        "D": { "x": 540, "y": 640 }
      }
    },
    {
      "question_id": 5,
      "options": {
        "A": { "x": 300, "y": 720 },
        "B": { "x": 380, "y": 720 },
        "C": { "x": 460, "y": 720 },
        "D": { "x": 540, "y": 720 }
      }
    },
    {
      "question_id": 6,
      "options": {
        "A": { "x": 300, "y": 800 },
        "B": { "x": 380, "y": 800 },
        "C": { "x": 460, "y": 800 },
        "D": { "x": 540, "y": 800 }
      }
    },
    {
      "question_id": 7,
      "options": {
        "A": { "x": 300, "y": 880 },
        "B": { "x": 380, "y": 880 },
        "C": { "x": 460, "y": 880 },
        "D": { "x": 540, "y": 880 }
      }
    },
    {
      "question_id": 8,
      "options": {
        "A": { "x": 300, "y": 960 },
        "B": { "x": 380, "y": 960 },
        "C": { "x": 460, "y": 960 },
        "D": { "x": 540, "y": 960 }
      }
    },
    {
      "question_id": 9,
      "options": {
        "A": { "x": 300, "y": 1040 },
        "B": { "x": 380, "y": 1040 },
        "C": { "x": 460, "y": 1040 },
        "D": { "x": 540, "y": 1040 }
      }
    },
    {
      "question_id": 10,
      "options": {
        "A": { "x": 300, "y": 1120 },
        "B": { "x": 380, "y": 1120 },
        "C": { "x": 460, "y": 1120 },
        "D": { "x": 540, "y": 1120 }
      }
    },
    {
      "question_id": 11,
      "options": {
        "A": { "x": 300, "y": 1200 },
        "B": { "x": 380, "y": 1200 },
        "C": { "x": 460, "y": 1200 },
        "D": { "x": 540, "y": 1200 }
      }
    },
    {
      "question_id": 12,
      "options": {
        "A": { "x": 300, "y": 1280 },
        "B": { "x": 380, "y": 1280 },
        "C": { "x": 460, "y": 1280 },
        "D": { "x": 540, "y": 1280 }
      }
    },
    {
      "question_id": 13,
      "options": {
        "A": { "x": 300, "y": 1360 },
        "B": { "x": 380, "y": 1360 },
        "C": { "x": 460, "y": 1360 },
        "D": { "x": 540, "y": 1360 }
      }
    },
    {
      "question_id": 14,
      "options": {
        "A": { "x": 300, "y": 1440 },
        "B": { "x": 380, "y": 1440 },
        "C": { "x": 460, "y": 1440 },
        "D": { "x": 540, "y": 1440 }
      }
    },
    {
      "question_id": 15,
      "options": {
        "A": { "x": 300, "y": 1520 },
        "B": { "x": 380, "y": 1520 },
        "C": { "x": 460, "y": 1520 },
        "D": { "x": 540, "y": 1520 }
      }
    },
    {
      "question_id": 16,
      "options": {
        "A": { "x": 300, "y": 1600 },
        "B": { "x": 380, "y": 1600 },
        "C": { "x": 460, "y": 1600 },
        "D": { "x": 540, "y": 1600 }
      }
    },
    {
      "question_id": 17,
      "options": {
        "A": { "x": 300, "y": 1680 },
        "B": { "x": 380, "y": 1680 },
        "C": { "x": 460, "y": 1680 },
        "D": { "x": 540, "y": 1680 }
      }
    },
    {
      "question_id": 18,
      "options": {
        "A": { "x": 300, "y": 1760 },
        "B": { "x": 380, "y": 1760 },
        "C": { "x": 460, "y": 1760 },
        "D": { "x": 540, "y": 1760 }
      }
    },
    {
      "question_id": 19,
      "options": {
        "A": { "x": 300, "y": 1840 },
        "B": { "x": 380, "y": 1840 },
        "C": { "x": 460, "y": 1840 },
        "D": { "x": 540, "y": 1840 }
      }
    },
    {
      "question_id": 20,
      "options": {
        "A": { "x": 300, "y": 1920 },
        "B": { "x": 380, "y": 1920 },
        "C": { "x": 460, "y": 1920 },
        "D": { "x": 540, "y": 1920 }
      }
    }
  ],
  "metadata": {
    "created_at": "2026-01-18T00:00:00Z",
    "author": "GradeLens System",
    "notes": "Example template with 20 questions, 4 options each. Coordinates are approximate and must be calibrated with actual form."
  }
}
